<?xml version="1.0" encoding="UTF-8"?>
<pm:SubmittedMeterValues xsi:schemaLocation="http://www.pjm.com/soa/schemas/external/pm/v1 powermeter.xsd" xmlns:pm="http://www.pjm.com/soa/schemas/external/pm/v1" xmlns:xsi="http://www.w3.org/2001/XMLSchema-instance">
	<meterAccount>
		<meterAccountID>20048</meterAccountID>
			<meterValues>
				<intervalValue>
					<startDate>2013-03-10T05:00:00</startDate>
					<endDate>2013-03-10T06:00:00Z</endDate>
					<mw>1013</mw>
				</intervalValue>
				<intervalValue>
					<startDate>2013-03-10T06:00:00Z</startDate>
					<endDate>2013-03-10T07:00:00Z</endDate>
					<mw>211.313</mw>
				</intervalValue>
				<intervalValue>
					<startDate>2013-03-10T07:00:00Z</startDate>
					<endDate>2013-03-10T08:00:00Z</endDate>
					<mw>3.002</mw>
				</intervalValue>
				<intervalValue>
					<startDate>2013-03-10T08:00:00Z</startDate>
					<endDate>2013-03-10T09:00:00Z</endDate>
					<mw>-11.33</mw>
				</intervalValue>
				<intervalValue>
					<startDate>2013-03-10T09:00:00Z</startDate>
					<endDate>2013-03-10T10:00:00Z</endDate>
					<mw>-500.000</mw>
				</intervalValue>
				<intervalValue>
					<startDate>2013-03-10T10:00:00Z</startDate>
					<endDate>2013-03-10T11:00:00Z</endDate>
					<mw>-600.114</mw>
				</intervalValue>
				<intervalValue>
					<startDate>2013-03-10T11:00:00Z</startDate>
					<endDate>2013-03-10T12:00:00Z</endDate>
					<mw>7</mw>
				</intervalValue>
				<intervalValue>
					<startDate>2013-03-10T12:00:00Z</startDate>
					<endDate>2013-03-10T13:00:00Z</endDate>
					<mw>8</mw>
				</intervalValue>
				<intervalValue>
					<startDate>2013-03-10T13:00:00Z</startDate>
					<endDate>2013-03-10T14:00:00Z</endDate>
					<mw>9</mw>
				</intervalValue>
				<intervalValue>
					<startDate>2013-03-10T14:00:00Z</startDate>
					<endDate>2013-03-10T15:00:00Z</endDate>
					<mw>10</mw>
				</intervalValue>
				<intervalValue>
					<startDate>2013-03-10T15:00:00Z</startDate>
					<endDate>2013-03-10T16:00:00Z</endDate>
					<mw>11</mw>
				</intervalValue>
				<intervalValue>
					<startDate>2013-03-10T16:00:00Z</startDate>
					<endDate>2013-03-10T17:00:00Z</endDate>
					<mw>12</mw>
				</intervalValue>
				<intervalValue>
					<startDate>2013-03-10T17:00:00Z</startDate>
					<endDate>2013-03-10T18:00:00Z</endDate>
					<mw>13</mw>
				</intervalValue>
				<intervalValue>
					<startDate>2013-03-10T18:00:00Z</startDate>
					<endDate>2013-03-10T19:00:00Z</endDate>
					<mw>14.333</mw>
				</intervalValue>
				<intervalValue>
					<startDate>2013-03-10T19:00:00Z</startDate>
					<endDate>2013-03-10T20:00:00Z</endDate>
					<mw>15.333</mw>
				</intervalValue>
				<intervalValue>
					<startDate>2013-03-10T20:00:00Z</startDate>
					<endDate>2013-03-10T21:00:00Z</endDate>
					<mw>16</mw>
				</intervalValue>
				<intervalValue>
					<startDate>2013-03-10T21:00:00Z</startDate>
					<endDate>2013-03-10T22:00:00Z</endDate>
					<mw>1700</mw>
				</intervalValue>
				<intervalValue>
					<startDate>2013-03-10T22:00:00Z</startDate>
					<endDate>2013-03-10T23:00:00Z</endDate>
					<mw>18.18</mw>
				</intervalValue>
				<intervalValue>
					<startDate>2013-03-10T23:00:00Z</startDate>
					<endDate>2013-03-11T00:00:00Z</endDate>
					<mw>1999.193</mw>
				</intervalValue>
				<intervalValue>
					<startDate>2013-03-11T00:00:00Z</startDate>
					<endDate>2013-03-11T01:00:00Z</endDate>
					<mw>20.333</mw>
				</intervalValue>
				<intervalValue>
					<startDate>2013-03-11T01:00:00Z</startDate>
					<endDate>2013-03-11T02:00:00Z</endDate>
					<mw>21.333</mw>
				</intervalValue>
				<intervalValue>
					<startDate>2013-03-11T02:00:00Z</startDate>
					<endDate>2013-03-11T03:00:00Z</endDate>
					<mw>22.333</mw>
				</intervalValue>
				<intervalValue>
					<startDate>2013-03-11T03:00:00Z</startDate>
					<endDate>2013-03-11T04:00:00Z</endDate>
					<mw>23.333</mw>
				</intervalValue>
		</meterValues>
	</meterAccount>	

	

</pm:SubmittedMeterValues>